{
  "$schema": "https://json-schema.org/draft/2020-12/schema",
  "$id": "https://project-assistant.local/decision-card/v1.json",
  "title": "Decision Card v1",
  "description": "The durable record of a decision once made — an Architecture Decision Record (ADR) generalized to project decisions. Follows Michael Nygard's core (title, status, context, decision, consequences) with MADR's supplemental fields (decision drivers, options considered). This is distinct from an action-card of type 'decision', which represents a decision that still needs to be DRIVEN; a decision-card is the recorded OUTCOME, and can close such an action-card via resolves_action_card. Lives in <project>/decisions/.",
  "type": "object",
  "required": ["schema_version", "id", "project_id", "title", "status", "date", "context", "decision", "consequences", "decision_makers"],
  "additionalProperties": false,
  "properties": {
    "schema_version": {"type": "integer", "const": 1},
    "id": {
      "type": "string",
      "pattern": "^DEC-[A-Z]{2,10}-[A-Z]{2,7}-[0-9]{3}$",
      "description": "Format: DEC-{customer_code}-{project_code}-{NNN}. Numbered sequentially per project. Example: DEC-ACME-CLOUD-001."
    },
    "project_id": {"type": "string", "pattern": "^[A-Z]{2,10}-[A-Z]{2,7}$"},
    "title": {"type": "string", "minLength": 3, "maxLength": 200, "description": "Short noun phrase naming the decision, e.g. 'Phased cutover over single-weekend big-bang'."},
    "status": {
      "type": "string",
      "enum": ["proposed", "accepted", "rejected", "superseded", "deprecated"],
      "description": "ADR lifecycle. proposed=stakeholders have not agreed yet; accepted=agreed and in force; rejected=considered and declined; superseded=replaced by a later decision (set superseded_by); deprecated=no longer applies but not directly replaced."
    },
    "date": {"type": "string", "pattern": "^\\d{4}-\\d{2}-\\d{2}$", "description": "Date the decision reached its current status."},
    "cynefin_domain": {
      "type": ["string", "null"],
      "enum": ["clear", "complicated", "complex", "chaotic", "disorder", null],
      "description": "Optional: the Cynefin domain this decision was made in (see reference/cynefin.md). Records the KIND of decision — clear=apply known practice; complicated=analyzable trade-off; complex=resolved via safe-to-fail probes; chaotic=made under crisis to stabilize. Useful when reviewing later why the decision was approached the way it was."
    },
    "context": {"type": "string", "minLength": 10, "description": "The forces at play — technical, political, commercial, schedule — stated value-neutrally as facts. Why is a decision needed now? (Nygard 'Context'.)"},
    "decision": {"type": "string", "minLength": 5, "description": "The decision itself, in active voice: 'We will ...'. (Nygard 'Decision'.)"},
    "consequences": {"type": "string", "minLength": 5, "description": "The resulting context after applying the decision — both the benefits and the new constraints/costs it creates. (Nygard 'Consequences'.)"},
    "decision_drivers": {
      "type": "array",
      "items": {"type": "string"},
      "default": [],
      "description": "MADR: the factors that most influenced the choice (e.g. 'must clear the data-center backstop', 'minimize business disruption')."
    },
    "options_considered": {
      "type": "array",
      "description": "MADR: the alternatives weighed. Recording rejected options is what makes a decision auditable later. Set chosen=true on the one option that matches the `decision` prose (exactly one on an accepted/proposed card; leave all false on a rejected card).",
      "items": {
        "type": "object",
        "required": ["option"],
        "additionalProperties": false,
        "properties": {
          "option": {"type": "string"},
          "pros": {"type": "array", "items": {"type": "string"}, "default": []},
          "cons": {"type": "array", "items": {"type": "string"}, "default": []},
          "chosen": {"type": "boolean", "default": false}
        }
      }
    },
    "decision_makers": {
      "type": "array",
      "minItems": 1,
      "description": "Who actually made (or owns) the call. A decision with no named decision-maker is a decision nobody is accountable for.",
      "items": {
        "type": "object",
        "required": ["party"],
        "additionalProperties": false,
        "properties": {
          "party": {"type": "string"},
          "person": {"type": ["string", "null"]},
          "contact_id": {"type": ["string", "null"], "pattern": "^CONTACT-[A-Z]{2,10}-[a-z0-9-]+$"}
        }
      }
    },
    "supersedes": {"type": "array", "items": {"type": "string", "pattern": "^DEC-[A-Z]{2,10}-[A-Z]{2,7}-[0-9]{3}$"}, "default": []},
    "superseded_by": {"type": ["string", "null"], "pattern": "^DEC-[A-Z]{2,10}-[A-Z]{2,7}-[0-9]{3}$"},
    "resolves_action_card": {
      "type": ["string", "null"],
      "pattern": "^[A-Z]{2,4}-[A-Z]{2,10}-[A-Z]{2,7}-[0-9]{4}[A-Z]?$",
      "description": "The action-card of type 'decision' that this record closes out (the 'decision to be made' that has now been made)."
    },
    "decided_at_meeting": {
      "type": ["string", "null"],
      "pattern": "^MTG-[A-Z]{2,10}-[A-Z]{2,7}-\\d{4}-\\d{2}-\\d{2}-\\d{2}$",
      "description": "The meeting-card where the decision was taken, if applicable."
    },
    "action_cards": {
      "type": "array",
      "items": {"type": "string", "pattern": "^[A-Z]{2,4}-[A-Z]{2,10}-[A-Z]{2,7}-[0-9]{4}[A-Z]?$"},
      "default": [],
      "description": "Action-cards that follow FROM the decision (the work it sets in motion)."
    },
    "updated": {"type": ["string", "null"], "pattern": "^\\d{4}-\\d{2}-\\d{2}$", "description": "Date this card was last touched (distinct from `date`, the decision date)."},
    "tags": {"type": "array", "items": {"type": "string"}, "default": []}
  }
}
